{
 "$schema": "../../../../schemas/card.schema.json",
 "id": "cs-idioms",
 "title": {
  "ru": "Идио́мы",
  "en": "Idioms"
 },
 "bonusXp": 250,
 "cards": [
  {
   "id": "c-ni-pukha",
   "name": {
    "ru": "Ни пу́ха ни пера́!",
    "en": "Good luck!"
   },
   "rarity": "common",
   "art": {
    "icon": "🪶",
    "hue": 50
   },
   "level": "A2",
   "blurb": {
    "id": "c-ni-pukha-blurb",
    "kind": "card-blurb",
    "level": "A2",
    "title": {
     "ru": "Ни пу́ха ни пера́!",
     "en": "Good luck!"
    },
    "sentences": [
     {
      "para": true,
      "en": "People say this before an exam.",
      "tokens": [
       {
        "t": "Так",
        "lex": "o:так",
        "lemma": "так",
        "g": {
         "pos": "adv"
        }
       },
       {
        "t": "говоря́т",
        "lex": "v:говорить",
        "lemma": "говори́ть",
        "g": {
         "pos": "verb",
         "aspect": "impf",
         "tense": "pres",
         "person": 3,
         "number": "pl"
        }
       },
       {
        "t": "пе́ред",
        "lex": "o:перед",
        "lemma": "пе́ред",
        "g": {
         "pos": "prep"
        }
       },
       {
        "t": "экза́меном",
        "sp": false,
        "lex": "n:экзамен",
        "lemma": "экза́мен",
        "g": {
         "pos": "noun",
         "case": "ins",
         "number": "sg"
        },
        "rare": true
       },
       {
        "t": ".",
        "sp": false
       }
      ]
     },
     {
      "en": "The reply is \"To the devil!\" It isn't rude; it's tradition.",
      "tokens": [
       {
        "t": "Отвеча́ть",
        "lex": "v:отвечать",
        "lemma": "отвеча́ть",
        "g": {
         "pos": "verb",
         "aspect": "impf"
        }
       },
       {
        "t": "на́до",
        "sp": false,
        "lex": "o:надо",
        "lemma": "на́до",
        "g": {
         "pos": "pred"
        }
       },
       {
        "t": ":"
       },
       {
        "t": "«",
        "sp": false
       },
       {
        "t": "К",
        "lex": "o:к",
        "lemma": "к",
        "g": {
         "pos": "prep"
        }
       },
       {
        "t": "чёрту",
        "sp": false,
        "lex": "n:чёрт",
        "lemma": "чёрт",
        "g": {
         "pos": "noun",
         "case": "dat",
         "number": "sg"
        }
       },
       {
        "t": "!",
        "sp": false
       },
       {
        "t": "»"
       },
       {
        "t": "Э́то",
        "lex": "o:это",
        "lemma": "э́то",
        "g": {
         "pos": "pron"
        }
       },
       {
        "t": "не",
        "lex": "o:не",
        "lemma": "не",
        "g": {
         "pos": "part"
        }
       },
       {
        "t": "гру́бо",
        "sp": false,
        "lex": "o:грубо",
        "lemma": "гру́бо",
        "g": {
         "pos": "adv"
        },
        "rare": true
       },
       {
        "t": ","
       },
       {
        "t": "а",
        "lex": "o:а",
        "lemma": "а",
        "g": {
         "pos": "conj"
        }
       },
       {
        "t": "тради́ция",
        "sp": false,
        "lex": "n:традиция",
        "lemma": "тради́ция",
        "g": {
         "pos": "noun",
         "case": "nom",
         "number": "sg"
        },
        "rare": true
       },
       {
        "t": ".",
        "sp": false
       }
      ]
     }
    ],
    "questions": []
   }
  },
  {
   "id": "c-sobaka",
   "name": {
    "ru": "Вот где соба́ка зары́та",
    "en": "That's the heart of the matter"
   },
   "rarity": "rare",
   "art": {
    "icon": "🐕",
    "hue": 30
   },
   "level": "B1",
   "blurb": {
    "id": "c-sobaka-blurb",
    "kind": "card-blurb",
    "level": "B1",
    "title": {
     "ru": "Вот где соба́ка зары́та",
     "en": "That's the heart of the matter"
    },
    "sentences": [
     {
      "para": true,
      "en": "Literally: that's where the dog lies buried.",
      "tokens": [
       {
        "t": "Буква́льно",
        "sp": false,
        "lex": "o:буквально",
        "lemma": "буква́льно",
        "g": {
         "pos": "adv"
        }
       },
       {
        "t": ":"
       },
       {
        "t": "вот",
        "lex": "o:вот",
        "lemma": "вот",
        "g": {
         "pos": "part"
        }
       },
       {
        "t": "где",
        "lex": "o:где",
        "lemma": "где",
        "g": {
         "pos": "adv"
        }
       },
       {
        "t": "лежи́т",
        "lex": "v:лежать",
        "lemma": "лежа́ть",
        "g": {
         "pos": "verb",
         "aspect": "impf",
         "tense": "pres",
         "person": 3,
         "number": "sg"
        }
       },
       {
        "t": "соба́ка",
        "sp": false,
        "lex": "n:собака",
        "lemma": "соба́ка",
        "g": {
         "pos": "noun",
         "case": "nom",
         "number": "sg"
        }
       },
       {
        "t": ".",
        "sp": false
       }
      ]
     },
     {
      "en": "People say this when they've found the real cause of a problem.",
      "tokens": [
       {
        "t": "Э́ту",
        "lex": "a:этот",
        "lemma": "э́тот",
        "g": {
         "pos": "adj",
         "case": "acc",
         "number": "sg",
         "gender": "f"
        }
       },
       {
        "t": "фра́зу",
        "lex": "n:фраза",
        "lemma": "фра́за",
        "g": {
         "pos": "noun",
         "case": "acc",
         "number": "sg"
        }
       },
       {
        "t": "говоря́т",
        "sp": false,
        "lex": "v:говорить",
        "lemma": "говори́ть",
        "g": {
         "pos": "verb",
         "aspect": "impf",
         "tense": "pres",
         "person": 3,
         "number": "pl"
        }
       },
       {
        "t": ","
       },
       {
        "t": "когда́",
        "lex": "o:когда",
        "lemma": "когда́",
        "g": {
         "pos": "conj"
        }
       },
       {
        "t": "нашли́",
        "lex": "v:найти",
        "lemma": "найти́",
        "g": {
         "pos": "verb",
         "aspect": "pf",
         "tense": "past",
         "number": "pl"
        }
       },
       {
        "t": "настоя́щую",
        "lex": "a:настоящий",
        "lemma": "настоя́щий",
        "g": {
         "pos": "adj",
         "case": "acc",
         "number": "sg",
         "gender": "f"
        }
       },
       {
        "t": "причи́ну",
        "lex": "n:причина",
        "lemma": "причи́на",
        "g": {
         "pos": "noun",
         "case": "acc",
         "number": "sg"
        }
       },
       {
        "t": "пробле́мы",
        "sp": false,
        "lex": "n:проблема",
        "lemma": "пробле́ма",
        "g": {
         "pos": "noun",
         "case": "gen",
         "number": "sg"
        }
       },
       {
        "t": ".",
        "sp": false
       }
      ]
     }
    ],
    "questions": []
   }
  },
  {
   "id": "c-lapsha",
   "name": {
    "ru": "Ве́шать лапшу́ на у́ши",
    "en": "To pull someone's leg"
   },
   "rarity": "rare",
   "art": {
    "icon": "🍜",
    "hue": 40
   },
   "level": "B1",
   "blurb": {
    "id": "c-lapsha-blurb",
    "kind": "card-blurb",
    "level": "B1",
    "title": {
     "ru": "Ве́шать лапшу́ на у́ши",
     "en": "To pull someone's leg"
    },
    "sentences": [
     {
      "para": true,
      "en": "If someone is hanging noodles on your ears, they're fooling you.",
      "tokens": [
       {
        "t": "Е́сли",
        "lex": "o:если",
        "lemma": "е́сли",
        "g": {
         "pos": "conj"
        }
       },
       {
        "t": "кто́-то",
        "lex": "o:кто-то",
        "lemma": "кто́-то",
        "g": {
         "pos": "pron",
         "case": "nom"
        }
       },
       {
        "t": "ве́шает",
        "lex": "v:вешать",
        "lemma": "ве́шать",
        "g": {
         "pos": "verb",
         "aspect": "impf",
         "tense": "pres",
         "person": 3,
         "number": "sg"
        },
        "rare": true
       },
       {
        "t": "вам",
        "lex": "o:вы",
        "lemma": "вы",
        "g": {
         "pos": "pron",
         "case": "dat"
        }
       },
       {
        "t": "лапшу́",
        "lex": "n:лапша",
        "lemma": "лапша́",
        "g": {
         "pos": "noun",
         "case": "acc",
         "number": "sg"
        },
        "rare": true
       },
       {
        "t": "на",
        "lex": "o:на",
        "lemma": "на",
        "g": {
         "pos": "prep"
        }
       },
       {
        "t": "у́ши",
        "sp": false,
        "lex": "n:ухо",
        "lemma": "у́хо",
        "g": {
         "pos": "noun",
         "case": "acc",
         "number": "pl"
        }
       },
       {
        "t": ","
       },
       {
        "t": "он",
        "lex": "o:он",
        "lemma": "он",
        "g": {
         "pos": "pron",
         "case": "nom"
        }
       },
       {
        "t": "вас",
        "lex": "o:вы",
        "lemma": "вы",
        "g": {
         "pos": "pron",
         "case": "acc"
        }
       },
       {
        "t": "обма́нывает",
        "sp": false,
        "lex": "v:обманывать",
        "lemma": "обма́нывать",
        "g": {
         "pos": "verb",
         "aspect": "impf",
         "tense": "pres",
         "person": 3,
         "number": "sg"
        }
       },
       {
        "t": ".",
        "sp": false
       }
      ]
     },
     {
      "en": "\"Don't hang noodles on my ears!\" is what you say to a friend who's lying.",
      "tokens": [
       {
        "t": "«",
        "sp": false
       },
       {
        "t": "Не",
        "lex": "o:не",
        "lemma": "не",
        "g": {
         "pos": "part"
        }
       },
       {
        "t": "ве́шай",
        "lex": "v:вешать",
        "lemma": "ве́шать",
        "g": {
         "pos": "verb",
         "aspect": "impf",
         "mood": "imp",
         "number": "sg"
        },
        "rare": true
       },
       {
        "t": "мне",
        "lex": "o:я",